{
  "annotation": "",
  "carrier_type": [
    "Band"
  ],
  "content_type": [
    "unbewegtes Bild",
    "Text"
  ],
  "created": "2026-06-11 10:17:37.425Z",
  "dimensions": "",
  "edit_comment": "",
  "edit_fielddata": null,
  "edit_state": "Seen",
  "edition": "",
  "extent": "",
  "incipit_statement": "",
  "language": [
    "ger"
  ],
  "musenalm_deprecated": {
    "reihentitel": "Frauenzimmerkalender (Zürich) 1784",
    "norm": "",
    "biblio": 409940,
    "status": [
      "Original vorhanden"
    ],
    "gesichtet": false,
    "erfasst": false,
    "bearbeitet_am": "2025-06-11T00:00:00",
    "bearbeitet_von": "ms"
  },
  "musenalm_id": 4893,
  "parallel_title": "",
  "place_statement": "Zürich",
  "places": [],
  "preferred_title": "Frauenzimmerkalender (Zürich) 1784",
  "pseudonym": false,
  "publication_statement": "",
  "refs": "nicht bei K; nicht bei L/R",
  "responsibility_statement": "unbezeichnet",
  "subtitle_statement": "",
  "title_statement": "Frauen Zimmer / Calender / Auf das Jahr / 1784 / Zürich bey / Johann Hoffmeister / an der Rosen Gaß",
  "updated": "2026-06-11 10:18:56.034Z",
  "variant_title": "",
  "year": 1784,
  "editor": "",
  "items": [
    {
      "annotation": "",
      "condition": "",
      "created": "2026-06-11 10:17:37.827Z",
      "edit_comment": "",
      "edit_state": "Edited",
      "identifier": "412456",
      "location": "107G06",
      "media": [
        "Original"
      ],
      "owner": "Theodor Springmann Stiftung",
      "scans": [],
      "updated": "2026-06-11 10:17:37.827Z",
      "uri": "",
      "public": false,
      "basis": true,
      "editor": "",
      "source_id": "fc74qwpdrkakhx2"
    }
  ],
  "agents": [
    {
      "annotation": "",
      "conjecture": false,
      "created": "2026-06-11 10:18:56.205Z",
      "edit_comment": "",
      "type": "Verlag",
      "uncertain": false,
      "updated": "2026-06-11 10:18:56.205Z",
      "agent": "vjiyycub4l15j8f",
      "source_id": "1sv78yps13y2pte"
    }
  ]
}
