{
  "annotation": "",
  "carrier_type": [
    "Band"
  ],
  "content_type": [
    "unbewegtes Bild",
    "Text"
  ],
  "created": "2026-06-11 10:17:36.738Z",
  "dimensions": "",
  "edit_comment": "",
  "edit_fielddata": null,
  "edit_state": "Edited",
  "edition": "",
  "extent": "VB, verso G, T, SS 1–336 darin 5 GG",
  "incipit_statement": "",
  "language": [
    "ger"
  ],
  "musenalm_deprecated": {
    "reihentitel": "Almanach dramatischer Spiele zur geselligen Unterhaltung auf dem Lande 1812",
    "norm": "~",
    "biblio": 100042,
    "status": [
      "Original vorhanden"
    ],
    "gesichtet": true,
    "erfasst": true,
    "bearbeitet_am": "2010-01-04T00:00:00",
    "bearbeitet_von": "jb"
  },
  "musenalm_id": 1280,
  "parallel_title": "",
  "place_statement": "Leipzig (Hartmann)",
  "places": [
    "d7kbujq7399g22j"
  ],
  "preferred_title": "Almanach dramatischer Spiele zur geselligen Unterhaltung auf dem Lande 1812",
  "pseudonym": false,
  "publication_statement": "",
  "refs": "K 18; L/R 121; Goed VIII. 127, 1",
  "responsibility_statement": "A. von Kotzebue",
  "subtitle_statement": "",
  "title_statement": "ALMANACH / Dramatischer Spiele / zur geselligen Unterhaltung / auf dem Lande / von / A. von KOTZEBUE. / Zehnter Jahrgang / Leipzig / bei C. J. G. Hartmann, / 1812",
  "updated": "2026-06-11 10:18:54.998Z",
  "variant_title": "",
  "year": 1812,
  "editor": "",
  "items": [
    {
      "annotation": "1803-1820?.\nSchwarzer Ledereinband gut erhalten.\n1812: Mit Ku 6(coloriert) und 336 SS.",
      "condition": "3b",
      "created": "2026-06-11 10:17:37.461Z",
      "edit_comment": "",
      "edit_state": "Edited",
      "identifier": "100042",
      "location": "105C05",
      "media": [
        "Original"
      ],
      "owner": "Theodor Springmann Stiftung",
      "scans": [],
      "updated": "2026-06-11 10:17:37.461Z",
      "uri": "",
      "public": false,
      "basis": true,
      "editor": "",
      "source_id": "tlxk2y2wvbzzxbc"
    }
  ],
  "agents": [
    {
      "annotation": "",
      "conjecture": false,
      "created": "2026-06-11 10:18:54.873Z",
      "edit_comment": "",
      "type": "Herausgeber:in",
      "uncertain": false,
      "updated": "2026-06-11 10:18:54.873Z",
      "agent": "sse24vstbh0jbtd",
      "source_id": "5s0byv0nlqi4imn"
    },
    {
      "annotation": "",
      "conjecture": false,
      "created": "2026-06-11 10:18:55.966Z",
      "edit_comment": "",
      "type": "Verlag",
      "uncertain": false,
      "updated": "2026-06-11 10:18:55.966Z",
      "agent": "p9ks1mekociw0y5",
      "source_id": "dmm1lny8pp8e26x"
    }
  ]
}
