{
  "annotation": "",
  "carrier_type": [
    "Band"
  ],
  "content_type": [
    "unbewegtes Bild",
    "Text"
  ],
  "created": "2026-06-11 10:17:36.867Z",
  "dimensions": "",
  "edit_comment": "",
  "edit_fielddata": null,
  "edit_state": "Unknown",
  "edition": "",
  "extent": "",
  "incipit_statement": "",
  "language": [
    "ger"
  ],
  "musenalm_deprecated": {
    "reihentitel": "Freund des schönen Geschlechts, Der 1841",
    "norm": "",
    "biblio": 0,
    "status": null,
    "gesichtet": false,
    "erfasst": false,
    "bearbeitet_am": "2009-01-29T00:00:00",
    "bearbeitet_von": "ms"
  },
  "musenalm_id": 1005,
  "parallel_title": "",
  "place_statement": "Wien",
  "places": [
    "31n865keags4n1n"
  ],
  "preferred_title": "Freund des schönen Geschlechts, Der 1841",
  "pseudonym": false,
  "publication_statement": "",
  "refs": "K 48; L/R 64; Goed VIII. 61, 68a",
  "responsibility_statement": "",
  "subtitle_statement": "",
  "title_statement": "",
  "updated": "2026-06-11 10:18:54.680Z",
  "variant_title": "",
  "year": 1841,
  "editor": "",
  "items": [],
  "agents": [
    {
      "annotation": "",
      "conjecture": false,
      "created": "2026-06-11 10:18:54.791Z",
      "edit_comment": "",
      "type": "Herausgeber:in",
      "uncertain": false,
      "updated": "2026-06-11 10:18:54.791Z",
      "agent": "uto0tazb8xl0ih3",
      "source_id": "mn65dsvwcibl0je"
    }
  ]
}
